ID	TARGET	TEXT	STANCE	WORDS	LENGTH
846	春节放鞭炮	贴春联、放鞭炮还是在走访亲友呢不管做什么，一家人其乐融融在一起就是最好的。凤凰知音在此也祝愿世界各地的会员朋友渡过一个喜庆、祥和、美满的春节~	FAVOR	贴 春联 放鞭 放鞭炮 鞭炮 还是 在 走访 亲友 呢 不管 做 什么 一家 一家人 家人 其乐融融 乐融融 融融 在 一起 就是 最好 凤凰 知音 在 此 也 祝愿 世界 世界各地 各地 会员 朋友 渡过 一个 喜庆 祥和 美满 春节	40
847	春节放鞭炮	与去年同期43.04吨相比，略有减少。但不放有没有过年的气氛，试问春节放鞭炮对不对？	NONE	与 去年 去年同期 同期 43 04 吨 相比 略有 减少 但 不放 有没有 没有 过年 气氛 试问 春节 放鞭 放鞭炮 鞭炮 对 不对	23
848	春节放鞭炮	焚烧冥币的祭奠方式，尽量采取鲜花祭祀、植树祭祀等一些时尚文明的祭祀方式。*衢江云溪派出所@浙江衢州公安	AGAINST	焚烧 冥 币 祭奠 方式 尽量 采取 鲜花 祭祀 植树 祭祀 等 一些 时尚 文明 祭祀 方式 衢 江云 溪 派出 派出所 浙江 衢州 公安	25
849	春节放鞭炮	让入土为安的传统反而变成陈腐的“旧观念”。试问，你敢干涉少数民族的殡葬习俗吗？你敢用行政手段强行从公务员开始推行殡葬“三不留”吗？	FAVOR	让 入土 入土为安 传统 反而 变成 陈腐 旧 观念 试问 你 敢 干涉 少数 少数民族 民族 殡葬 习俗 吗 你 敢 用 行政 手段 强行 从 公务 公务员 开始 推行 殡葬 三 不留 吗	34
850	春节放鞭炮	拜大年……但总有这样一群人，他们在举国欢庆时坚守岗位，在万家团聚时默默奉献！我们指挥中心的搜救协调员、交管值班员人也是他们中的一员，他们全年无休！	FAVOR	拜 大年 但 总 有 这样 一群 人 他们 在 举国 举国欢庆 国欢庆 欢庆 时 坚守 坚守岗位 岗位 在 万家 团聚 时 默默 奉献 我们 指挥 中心 搜救 协调 协调员 交管 值班 值班员 人 也 是 他们 中 一员 他们 全年 无休	42
851	春节放鞭炮	但也有人表示新年不放鞭炮就没了年味，如遭遇极端天气，则建议或者强制禁放。你支持哪边，理由？如果不燃，有何管理办法？	NONE	但 也 有人 表示 新年 不 放鞭 放鞭炮 鞭炮 就 没了 年 味 如 遭遇 极端 天气 则 建议 或者 强制 禁放 你 支持 哪边 理由 如果 不 燃 有 何 管理 办法	33
852	春节放鞭炮	同意的举手。	AGAINST	同意 举手	2
853	春节放鞭炮	要是下雪就更好了。中国最大的传统节日是春节。外国人阴历年底很少有人在自己国家放鞭炮，吃饺子。尽管中国在世界的影响力与日俱增。阿嚏，钻被窝，睡觉。	FAVOR	要是 下雪 就 更好 中国 最大 传统 传统节日 节日 是 春节 外国 外国人 国人 阴历 年底 很少 有人 在 自己 国家 放鞭 放鞭炮 鞭炮 吃饺子 饺子 尽管 中国 在 世界 影响 影响力 与日俱增 阿嚏 钻 被窝 睡觉	37
854	春节放鞭炮	我市市民少放或不放鞭炮，用环保的方式来欢度新春佳节，过了一个清新、环保、舒适的“低碳”春节。家住安惠苑的王明先生说：“希望更多的人加入不放鞭炮的行列。”详见：http://t.cn/RwC6xQD	AGAINST	我市 市民 少 放 或 不 放鞭 放鞭炮 鞭炮 用 环保 方式 来 欢度 新春 新春佳节 佳节 过 一个 清新 环保 舒适 低 碳 春节 家住 安 惠 苑 王明 先生 说 希望 更多 人 加入 不 放鞭 放鞭炮 鞭炮 行列 详见 http t cn rwc6xqd	46
855	春节放鞭炮	最近网上有一组图片特别火，环卫工老大爷和老伴拿着一张呼吁大家春节少放鞭炮让老伴早点回家的牌子。春节放鞭炮，你还支持么？来聊聊吧~	NONE	最近 网上 有 一组 图片 特别 火 环卫 环卫工 老大 老大爷 大爷 老伴 拿 着 一张 呼吁 大家 春节 少 放鞭 放鞭炮 鞭炮 让 老伴 早点 回家 牌子 春节 放鞭 放鞭炮 鞭炮 你 还 支持 么 来 聊聊 聊聊吧	39
856	春节放鞭炮	拍摄了一组呼吁大家春节不放鞭炮的照片，通过此次宣传，树立全民自觉自愿“禁放”意识，真正体会到禁放人人有责，平安人人受益！祝愿所有人平平安安过春节！	AGAINST	拍摄 一组 呼吁 大家 春节 不 放鞭 放鞭炮 鞭炮 照片 通过 此次 宣传 树立 全民 自觉 自觉自愿 自愿 禁放 意识 真正 体会 到 禁放 人人 人人有责 有责 平安 人人 受益 祝愿 所有 所有人 有人 平平 平平安安 平安 安安 过 春节	40
857	春节放鞭炮	便有可能发生血的教训，所以家长们要注意孩子燃放鞭炮时的安全事项。在小编莉言语 看来：孩子放鞭炮的时候，大人一定要跟着看好孩子。	NONE	便 有 可能 发生 血 教训 所以 家长 们 要 注意 孩子 燃放 燃放鞭炮 放鞭 放鞭炮 鞭炮 时 安全 事项 在 小 编 莉 言语 看来 孩子 放鞭 放鞭炮 鞭炮 时候 大人 一定 要 跟着 看 好孩子 孩子	38
858	春节放鞭炮	济南市全民参与环保行动工作组、市环保局9日向广大市民发出倡议：今年春节期间少放或不放烟花爆竹，过一个文明祥和的环保年。　　烟花爆|少放鞭炮吧...	AGAINST	济南 济南市 南市 全民 参与 环保 行动 工作 工作组 市 环保 环保局 number 日 向 广大 市民 发出 倡议 今年 今年春节 春节 期间 少 放 或 不放 烟花 烟花爆竹 爆竹 过 一个 文明 祥和 环保 年 烟花 爆 少 放鞭 放鞭炮 鞭炮	42
859	春节放鞭炮	大家一起帮忙来填写吧！ http://t.cn/Rwnx25D	NONE	大家 一起 帮忙 来 填写 http t cn rwnx25d	9
860	春节放鞭炮	使烟花爆竹销量减少,鞭炮垃圾也大大减少。春节期间省城清理鞭炮纸屑889吨,比去年同期减少四成多。	AGAINST	使 烟花 烟花爆竹 爆竹 销量 减少 鞭炮 垃圾 也 大大 大大减少 减少 春节 期间 省城 清理 鞭炮 纸屑 number 吨 比 去年 去年同期 同期 减少 四成 多	27
861	春节放鞭炮	宁乡城镇及乡村都喜欢燃放鞭炮、礼花，我曾记得过年前后的老家黄材街上鞭炮声震耳欲聋，满地通红的纸屑。-宁乡网-红网宁乡站 http://t.cn/8Fz3Fsh	AGAINST	宁乡 城镇 及 乡村 都 喜欢 燃放 燃放鞭炮 放鞭 放鞭炮 鞭炮 礼花 我 曾 记得 过年 前后 老家 黄 材 街上 鞭炮 鞭炮声 炮声 震耳 震耳欲聋 满地 通红 纸屑 宁乡 网 红 网 宁乡 站 http t cn number fz3fsh	40
862	春节放鞭炮	春节有着各式各样的风俗，如备年货、贴春联、放鞭炮、守岁、拜年、给压岁钱等。正是这些风俗，让春节显得更加丰富多彩。	FAVOR	春节 有着 各式 各式各样 各样 风俗 如 备 年货 贴 春联 放鞭 放鞭炮 鞭炮 守岁 拜年 给 压岁 压岁钱 等 正是 这些 风俗 让 春节 显得 更加 丰富 丰富多彩 多彩	30
863	春节放鞭炮	今年春节不放鞭炮,保护我们的环境 我在这里:|回龙观	AGAINST	今年 今年春节 春节 不 放鞭 放鞭炮 鞭炮 保护 我们 环境 我 在 这里 回龙 回龙观	15
864	春节放鞭炮	会产生300公斤以上灰霾。今年春节，你还放鞭炮吗？点#春节放鞭炮#，参与话题投票吧！	AGAINST	会 产生 number 公斤 以上 灰 霾 今年 今年春节 春节 你 还 放鞭 放鞭炮 鞭炮 吗 点 春节 放鞭 放鞭炮 鞭炮 参与 话题 投票	24
865	春节放鞭炮	有人非要拿春节必须放鞭炮一说，那过去还非要一男配多女，偷情就处死，基被发现基本烧死，那你们也延续这样的传统好了。	AGAINST	有人 非要 拿 春节 必须 放鞭 放鞭炮 鞭炮 一 说 那 过去 还 非要 一 男 配 多 女 偷情 就 处死 基 被 发现 基本 烧死 那 你们 也 延续 这样 传统 好	34
866	春节放鞭炮	防止危险发生，防患于未然！请注意以下几点：	FAVOR	防止 危险 发生 防患 防患于未 防患于未然 于未然 未然 请 注意 以下 以下几点 几点	13
867	春节放鞭炮	更是寻求合家团聚，享受亲情的时刻。祭祖、放鞭炮、团圆饭是最传统的项目，包饺子吃贡面是最期待的美食，你闻到，这股年味了吗http://t.cn/8Fqz16b	FAVOR	更是 寻求 合家 团聚 享受 亲情 时刻 祭祖 放鞭 放鞭炮 鞭炮 团圆 团圆饭 是 最 传统 项目 包 饺子 吃 贡 面 是 最 期待 美食 你 闻到 这股 年 味 吗 http t cn number fqz16b	37
868	春节放鞭炮	全国多地发生森林火灾，呼吁广大市民切勿乱丢烟头，切勿在林区及附近燃放礼花、鞭炮，切勿在坟山点烛、烧纸，切勿在田间烧稻草，切勿在林区野外用火。	AGAINST	全国 多 地 发生 森林 火灾 呼吁 广大 市民 切勿 乱 丢 烟头 切勿 在 林区 及 附近 燃放 礼花 鞭炮 切勿 在 坟山 点 烛 烧纸 切勿 在 田间 烧 稻草 切勿 在 林区 野外 用 火	38
869	春节放鞭炮	为什么还要放?难道春节的气氛就只能靠放鞭炮吗？可是话说回来，如果是我，肯定是坚决不放了，但还是阻止不了家人在大年夜放呀，唉！	AGAINST	为什么 什么 还要 放 难道 春节 气氛 就 只能 只能靠 放鞭 放鞭炮 鞭炮 吗 可是 话说回来 回来 如果 是 我 肯定 是 坚决 不放 但 还是 阻止 阻止不了 不了 家人 在 大年 大年夜 年夜 放 呀 唉	37
870	春节放鞭炮	放鞭炮烟花…这些可是过新年必不可少的前奏~在古代，最重要的是冬至，但是最团圆的可是春节，所以让我们上一锅圆圆的肉丸吧 @广西大学共青团 @广西大学中加国际学院 @黄菀菀不是guan	FAVOR	放鞭 放鞭炮 鞭炮 烟花 这些 可是 过 新年 必不可少 不可 少 前奏 在 古代 最 重要 是 冬至 但是 最 团圆 可是 春节 所以 让 我们 上 一 锅 圆圆 圆圆的 肉丸 广西 广西大学 大学 共青 共青团 广西 广西大学 大学 中加 国际 学院 黄 不是 guan	46
871	春节放鞭炮	大家将体验中国舞狮，放鞭炮，传统民间音乐，舞蹈演员，武术表演等。活动从1月13开始到到2月17结束。（via@墨尔本团购缤纷淘 ）	FAVOR	大家 将 体验 中国 舞狮 放鞭 放鞭炮 鞭炮 传统 民间 音乐 舞蹈 舞蹈演员 演员 武术 表演 等 活动 从 number 月 number 开始 到 到 number 月 number 结束 via 墨尔本 团购 缤纷 淘	34
872	春节放鞭炮	穿新衣，但孩子可能并不知道这些习俗的由来。快过年啦，咕噜熊与您分享“年”的故事，让我们一起体验中国传统文化，品味纯正“中国味”的新年吧！http://t.cn/zYKeXEQ	FAVOR	穿 新衣 但 孩子 可能 并不知道 不知 知道 这些 习俗 由来 快 过年 啦 咕噜 熊 与 您 分享 年 故事 让 我们 一起 体验 中国 传统 文化 品味 纯正 中国 味 新年 http t cn zykexeq	37
873	春节放鞭炮	正好就是春节。春节指的是我们中国华夏民族的元旦，农历的第一天，正月初一。春节又称农历新年、|春节放鞭炮...	FAVOR	正好 就是 春节 春节 指 是 我们 中国 华夏 华夏民族 民族 元旦 农历 第一 第一天 一天 正月 正月初 正月初一 月初 初一 春节 又称 农历 新年 春节 放鞭 放鞭炮 鞭炮	29
874	春节放鞭炮	 合家欢乐喜庆祥和，我们不放鞭炮！ 春节PM2.5浓度降近四成 政府提倡百姓支持 京津地区少放鞭炮作用明显 ”元宵节&情人节“继续保持- 地球医生环保工作室 http://t.cn/8F0hWsZ	AGAINST	合家 合家欢 合家欢乐 欢乐 喜庆 祥和 我们 不 放鞭 放鞭炮 鞭炮 春节 pm2 5 浓度 降 近 四成 政府 提倡 百姓 支持 京津 京津地区 地区 少 放鞭 放鞭炮 鞭炮 作用 明显 元宵 元宵节 情人 情人节 继续 保持 地球 医生 环保 工作 工作室 http t cn number f0hwsz	47
875	春节放鞭炮	为了健康，不打算购买鞭炮；反对者：不放炮，缺少了年味！怎么样才能把年过得既有年味又环保呢？你有啥好点子？	NONE	为了 健康 不 打算 购买 鞭炮 反对 反对者 不 放炮 缺少 年 味 怎么 怎么样 才能 把 年 过 得 既有 年 味 又 环保 呢 你 有 啥 好 点子	31
876	春节放鞭炮	现在人的观念和老一代的是不同的，在他们脑子里放鞭炮是一种喜庆，一种热闹，一种节日寄托！所以对他们来说无炮可能真就不欢。 我在:|013县道	FAVOR	现在 人 观念 老一代 一代 是 不同 在 他们 脑子 脑子里 放鞭 放鞭炮 鞭炮 是 一种 喜庆 一种 热闹 一种 节日 寄托 所以 对 他们 来说 无 炮 可能 真 就 不 欢 我 在 number 县道	37
877	春节放鞭炮	这个春节你过得新颖时尚，还是“涛声依旧”？传统年味是否已经渐行渐远？你又品出了什么样的特别年味？亲，说说你感受到的年味，并@安徽日报，让我们一起来回味回味这个蛇年春节。	FAVOR	这个 春节 你 过 得 新颖 时尚 还是 涛声 依旧 传统 年 味 是否 已经 渐 行 渐 远 你 又 品出 什么 什么样 特别 年 味 亲 说 说 你 感受 到 年 味 并 安徽 日报 让 我们 一 起来 回味 回味 这个 蛇 年 春节	48
878	春节放鞭炮	承诺过年不放鞭炮的社区居民和中小学生，得到了志愿者书写的“福”字。	AGAINST	承诺 过年 不 放鞭 放鞭炮 鞭炮 社区 居民 中小 中小学 中小学生 小学 小学生 学生 得到 志愿 志愿者 愿者 书写 福 字	21
879	春节放鞭炮	#微倡议#倡议过环保春节，不放鞭炮 |微倡议 我在:|东风大街	AGAINST	微 倡议 倡议 过 环保 春节 不 放鞭 放鞭炮 鞭炮 微 倡议 我 在 东风 大街	16
880	春节放鞭炮	现如今环境就够差的了，暖冬导致的雨雪都不下，天天有雾霾，周围到处是感冒发烧的人，一冬天几乎每一人或自己的家人都感冒发烧了，可悲啊！	AGAINST	现如今 如今 环境 就 够 差 暖冬 导致 雨雪 都 不下 天天 有 雾 霾 周围 到处 是 感冒 发烧 人 一 冬天 几乎 每 一 人 或 自己 家人 都 感冒 发烧 可悲 啊	35
881	春节放鞭炮	真该消失在现代文明中，我们有很多方式可以表达节日的快乐，让日渐污浊的空气不在雪上加霜，爱地球才是人类的春节善举。	AGAINST	真 该 消失 在 现代 现代文 现代文明 文明 中 我们 有 很多 方式 可以 表达 节日 快乐 让 日渐 污浊 空气 不 在 雪上 雪上加霜 爱 地球 才 是 人类 春节 善举	32
882	春节放鞭炮	这些都少不了！除此之外，那些中国传统老规矩你还知道多少呢？小编小时候用筷子敲碗沒少挨老妈筷子打，小伙伴们快说说你的家乡还有哪些独特的传统老规矩吧！~	NONE	这些 都 少不了 不了 除此 除此之外 之外 那些 中国 传统 老规矩 规矩 你 还 知道 多少 呢 小 编 小时 小时候 时候 用 筷子 敲 碗 沒 少 挨 老妈 筷子 打 小伙 小伙伴 伙伴 们 快 说 说 你 家乡 还有 哪些 独特 传统 老规矩 规矩	47
883	春节放鞭炮	过个绿色环保春节，闷等大发财！	AGAINST	过 个 绿色 环保 春节 闷 等 大 发财	9
884	春节放鞭炮	米糠芜菁，豆腐和大葱的酱汤，米饭，牛奶。今天早晨电视里播放了中国春节放鞭炮的情景。中国人喜欢放鞭炮吧!	FAVOR	米糠 芜菁 豆腐 大葱 酱汤 米饭 牛奶 今天 早晨 电视 里 播放 中国 春节 放鞭 放鞭炮 鞭炮 情景 中国 人 喜欢 放鞭 放鞭炮 鞭炮	24
885	春节放鞭炮	其他的时间能不能规定晚上九点以后，早上6点之前不放啊？！家里有老人孩子的家伤不起啊。昨天女儿9点40躺下，快10点半了才睡。鞭炮声不断，怎么睡啊？	AGAINST	其他 时间 能 不能 规定 晚上 九点 以后 早上 number 点 之前 不放 啊 家里 有 老人 孩子 家 伤 不 起 啊 昨天 女儿 number 点 number 躺 下 快 number 点 半 才 睡 鞭炮 鞭炮声 炮声 不断 怎么 睡 啊	43
886	春节放鞭炮	大人小孩都同意不买了。 俺窃喜，省了鞭炮钱。	AGAINST	大人 小孩 都 同意 不 买 俺 窃喜 省 鞭炮 钱	11
887	春节放鞭炮	除夕当晚可以延长至次日2时。为更环保、更安全、更文明，请您少放或不放鞭炮。祝您春节快乐#猴年吉祥#	AGAINST	除夕 当晚 可以 延长 至 次日 number 时 为 更 环保 更 安全 更 文明 请 您 少 放 或 不 放鞭 放鞭炮 鞭炮 祝您 春节 春节快乐 快乐 猴 年 吉祥	31
888	春节放鞭炮	瓦伦西亚的街道也有特色，种满了橘子树，整个城市弥漫了醉人的橘子花香味。最后两张是本地的海鲜市场，和为了庆祝火祭节，在大街上煮著名西班牙海鲜饭的厨师。	FAVOR	瓦伦西 瓦伦西亚 伦西亚 西亚 街道 也 有 特色 种 满 橘子 树 整个 城市 弥漫 醉人 橘子 花 香味 最后 两张 是 本地 海鲜 市场 为了 庆祝 火祭 节 在 大街 上 煮 著名 西班牙 海鲜 饭 厨师	38
889	春节放鞭炮	放鞭炮、敲锣打 鼓、吃饺子、给压岁钱等习俗。 不同时期、不同地区、不同民族的 习俗都不相同。	NONE	放鞭 放鞭炮 鞭炮 敲锣 打 鼓 吃饺子 饺子 给 压岁 压岁钱 等 习俗 不同 时期 不同 地区 不同 民族 习俗 都 不 相同	23
890	春节放鞭炮	彻底解放烦人的过冬装备；异域风情，摩擦出律动的步伐；味蕾绽放，唇齿品鉴与大快朵颐共兼得；小伙伴们有没有想去的地方，征集意见可以直接留言。	FAVOR	彻底 解放 烦人 过冬 装备 异域 风情 摩擦 出 律动 步伐 味蕾 绽放 唇齿 品鉴 与 大快朵颐 朵颐 共 兼得 小伙 小伙伴 伙伴 们 有没有 没有 想去 地方 征集 意见 可以 直接 留言	33
891	春节放鞭炮	走亲戚等传统节目就像明星赶场，有没有什么新的过年方式？春节期间，河南值得游玩的地方有很多，也有很多新的游玩方式。详情请戳http://t.cn/8Fcuwxa @河南旅游新生活杂志	FAVOR	走亲戚 亲戚 等 传统 传统节目 节目 就 像 明星 赶场 有没有 没有 什么 新 过年 方式 春节 期间 河南 值得 游玩 地方 有 很多 也 有 很多 新 游玩 方式 详情 详情请 戳 http t cn number fcuwxa 河南 旅游 新 生活 杂志	43
892	春节放鞭炮	就是新年到了，家家户户都贴上了对联。过年可以包饺子，放鞭炮，穿新衣给亲人们百年|传统节日	FAVOR	就是 新年 到 家家 家家户户 家户 户户 都 贴 上 对联 过年 可以 包 饺子 放鞭 放鞭炮 鞭炮 穿 新衣 给 亲 人们 百年 传统 传统节日 节日	27
893	春节放鞭炮	谢谢体谅！”诚恳的语言透着辛酸。你的朋友圈被也有这张图片吗？阜阳的环卫工人和市民如何看待春节放鞭炮的？过年了，环卫工人又有啥心愿？详见明日颍州晚报。	NONE	谢谢 体谅 诚恳 语言 透 着 辛酸 你 朋友 朋友圈 被 也 有 这 张 图片 吗 阜阳 环卫 环卫工 环卫工人 工人 市民 如何 看待 春节 放鞭 放鞭炮 鞭炮 过年 环卫 环卫工 环卫工人 工人 又 有 啥 心愿 详见 明日 颍 州 晚报	43
894	春节放鞭炮	随机送出美图2014台历一本。	NONE	随机 送出 美 图 number 台历 一本	7
895	春节放鞭炮	烧毁了四辆车以及物业大楼北侧墙面。提醒博友：安全意识时刻都要放在心头。	AGAINST	烧毁 四辆 车 以及 物业 大楼 北侧 墙面 提醒 博 友 安全 安全意识 全意 意识 时刻 都 要 放在 心头	20
896	春节放鞭炮	对于春节放鞭炮的事情你怎么看 我就趴窗户看呐 ……	NONE	对于 春节 放鞭 放鞭炮 鞭炮 事情 你 怎么 看 我 就 趴 窗户 看 呐	15
897	春节放鞭炮	#警察蜀黍操碎了心#@TFBOYS-易烊千玺 春节放鞭炮消防员叔叔操碎了心捉迷藏警察叔叔操碎了心 宝宝你快向他们收代言费呀	AGAINST	警察 蜀黍 操 碎了心 tfboys 易 烊 千 玺 春节 放鞭 放鞭炮 鞭炮 消防 消防员 叔叔 操 碎了心 捉迷藏 迷藏 警察 叔叔 操 碎了心 宝宝 你 快 向 他们 收 代言 费 呀	33
898	春节放鞭炮	,,,历史问题,,咋搞,,,呵呵 ——看到陈九的博文《关于《禁止春节放鞭炮是馊主意》一文的补充发言》有感而发的评论。http://t.cn/zYSGZ6D	FAVOR	历史 问题 咋搞 呵呵 看到 陈 九 博文 关于 禁止 春节 放鞭 放鞭炮 鞭炮 是 馊主意 主意 一文 补充 发言 有感 有感而发 评论 http t cn zysgz6d	27
899	春节放鞭炮	近年来严重的空气问题让更多人决定#今年春节不放炮#。鞭炮厂商们除了减少产量之外，也推出了不少相对更环保的产品。 http://t.cn/8FIbvnX	AGAINST	近年 近年来 年来 严重 空气 问题 让 更 多 人 决定 今年 今年春节 春节 不 放炮 鞭炮 厂商 们 除了 减少 产量 之外 也 推出 不少 相对 更 环保 产品 http t cn number fibvnx	35
900	春节放鞭炮	一对小小的门神反应着我们对过年的年味越来越淡了，电影已动漫的形式，贴近生活，有趣，故事让我们回忆起小时候妈妈和我们讲的过年的事儿 为什么要放鞭炮啊 为什么家家户户贴门神啊？ 总之 有一种温暖的感觉	FAVOR	一对 小小 小小的 门神 反应 着 我们 对 过年 年 味 越来 越来越 淡 电影 已 动漫 形式 贴近 贴近生活 生活 有趣 故事 让 我们 回忆 回忆起 忆起 小时 小时候 时候 妈妈 我们 讲 过年 事儿 为什么 什么 要 放鞭 放鞭炮 鞭炮 啊 为什么 什么 家家 家家户户 家户 户户 贴 门神 啊 总之 有 一种 温暖 感觉	57
901	春节放鞭炮	火苗触及引信，一声巨响，刹时火光冲天，蘑菇云升起，类似核武爆炸。这一传统，沿袭至今，苏区百姓就是这么任性！@新浪福建@i游连城@V游福建	FAVOR	火苗 触及 引信 一声 巨响 刹时 火光 火光冲天 冲天 蘑菇 蘑菇云 升起 类似 核武 爆炸 这 一 传统 沿袭 至今 苏区 百姓 就是 这么 任性 新浪 福建 i 游 连城 v 游 福建	33
902	春节放鞭炮	我开始支持限制燃放，毕竟好环境对我们太稀缺了，但考虑到数千年的传统，我觉得不妨借鉴凯撒大帝的胡子税的做法——征收燃放税，而不是清朝留头不留发的做法。	FAVOR	我 开始 支持 限制 燃放 毕竟 好 环境 对 我们 太 稀缺 但 考虑 到 数千 数千年 千年 传统 我 觉得 不妨 借鉴 凯撒 凯撒大帝 大帝 胡子 税 做法 征收 燃放 税 而 不是 清朝 留 头 不留 发 做法	40
903	春节放鞭炮	因为可以贴春联，看春节联欢晚会，走亲访友，放鞭炮&bull;&bull;&bull;&bull;&bull;&bull;记得去年春节来临时|练字	FAVOR	因为 可以 贴 春联 看 春节 联欢 联欢晚会 晚会 走亲访友 访友 放鞭 放鞭炮 鞭炮 bull bull bull bull bull bull 记得 去年 春节 来 临时 练字	26
904	春节放鞭炮	不放或少放鞭炮。但除夕，破五，元宵节轰隆隆的鞭炮爆炸声告诉我们：道德约束多么苍白，无力！	AGAINST	不放 或 少 放鞭 放鞭炮 鞭炮 但 除夕 破五 元宵 元宵节 轰隆 轰隆隆 隆隆 鞭炮 爆炸 爆炸声 告诉 我们 道德 约束 多么 苍白 无力	24
905	春节放鞭炮	看春晚，放鞭炮。	FAVOR	看 春晚 放鞭 放鞭炮 鞭炮	5
906	春节放鞭炮	因为去了部队过年。而上一个清明节，我似乎也没有回来的印象了。真是很不该。	FAVOR	因为 去 部队 过年 而 上 一个 清明 清明节 我 似乎 也 没有 回来 印象 真是 很 不该	18
907	春节放鞭炮	当每天都有人抱怨着雾霾如何如何，春节放鞭炮就真的只能是一种口号吗？如果有一天连空气都要花钱购买的时候，还有多少人在意所谓的节日气氛乐呢？	AGAINST	当 每天 都 有人 抱怨 着 雾 霾 如何 如何 春节 放鞭 放鞭炮 鞭炮 就 真的 只能 是 一种 口号 吗 如果 有 一天 连 空气 都 要 花钱 购买 时候 还有 多少 人 在意 所谓 节日 气氛 乐 呢	40
908	春节放鞭炮	医院都会接收到被鞭炮炸伤、烧伤的病人，全市除夕当天的消防接处警量非常大，安全重于泰山，防患于未然很关键······	AGAINST	医院 都 会 接收 到 被 鞭炮 炸伤 烧伤 病人 全市 除夕 当天 消防 接处警 处警 量 非常 大 安全 重于 重于泰山 泰山 防患 防患于未 防患于未然 于未然 未然 很 关键	30
909	春节放鞭炮	从黑龙江来三亚过春节的李女士说，今年不放烟花鞭炮，不污染三亚的好空气；河南游客黄先生说将尽举手之劳为三亚增添一份干净。（孙婧）http://t.cn/Rw7IRiD您呢？	AGAINST	从 黑龙江 龙江 来 三亚 过 春节 李女士 女士 说 今年 不 放 烟花 鞭炮 不 污染 三亚 好 空气 河南 游客 黄先生 先生 说 将 尽 举手 举手之劳 之劳 为 三亚 增添 一份 干净 孙 婧 http t cn rw7irid 您 呢	43
910	春节放鞭炮	这一年才一次的焰火就造成空气污染了？医病不根治乱投医，得不偿失！	FAVOR	这 一年 才 一次 焰火 就 造成 空气 空气污染 污染 医病 不 根治 乱 投医 得不偿失	16
