ID	TARGET	TEXT	STANCE	WORDS	LENGTH
2212	开放二胎	你以为它傻呀？毕竟一个是鼓励多生娃，一个是不生。	NONE	你 以为 它 傻 呀 毕竟 一个 是 鼓励 多 生 娃 一个 是 不 生	16
2213	开放二胎	国家都开放二胎了，微博你凭什么不让我要，还好本宝宝我机智。	FAVOR	国家 都 开放 二胎 微 博 你 凭 什么 不让 我 要 还好 本 宝宝 我 机智	17
2214	开放二胎	德国拜尔BAYER 爱乐维男士款90颗 助孕片 提高精子质量和数量 二胎必备 提高怀孕几率 http://t.cn/Rq0KrhX |武安·邑城...	FAVOR	德国 拜尔 bayer 爱乐 爱乐维 男士 款 number 颗 助 孕 片 提高 精子 质量 数量 二胎 必备 提高 怀孕 几率 http t cn rq0krhx 武安 邑 城	28
2216	开放二胎	我为什么要生下他呢？” |我们为什么...	NONE	我 为什么 什么 要 生 下 他 呢 我们 为什么 什么	11
2217	开放二胎	一党制就是这么独断。就拿治理雾霾天说单双号就立刻马上执行不遵守就扣分罚钱，难道国家就只能如此肤浅解决问题。出台政策请问问过老百姓么？！	AGAINST	一党制 就是 这么 独断 就 拿 治理 雾 霾 天 说 单 双号 就 立刻 马上 执行 不 遵守 就 扣分 罚钱 难道 国家 就 只能 如此 肤浅 解决 解决问题 问题 出台 政策 请问 问 过 老百姓 百姓 么	39
2219	开放二胎	又有一部分人为了避开羊年纷纷推迟到猴年生育。并且认为属猴的孩子能讨到“聪明机智快乐”的好彩头…….所以你身边有准备生猴子的吗？	FAVOR	又 有 一部 一部分 部分 人 为了 避开 羊 年 纷纷 推迟 到 猴 年 生育 并且 认为 属 猴 孩子 能 讨到 聪明 机智 快乐 好彩头 彩头 所以 你 身边 有 准备 生 猴子 吗	36
2220	开放二胎	不是儒教的复兴。尊重亲情，反对儒教！道德沦丧需要基督教的感化，而不是骟马拉车、蒙驴拉磨，这是我的社会理想。	AGAINST	不是 儒教 复兴 尊重 亲情 反对 儒教 道德 沦丧 需要 基督 基督教 感化 而 不是 骟 马 拉车 蒙 驴 拉磨 这 是 我 社会 理想	26
2225	开放二胎	大长腿跳舞非常迷人，宝宝好想拥有跟你一样的大长腿！@青春无敌美少女任帅 |秒拍视频	NONE	大 长 腿 跳舞 非常 迷人 宝宝 好 想 拥有 跟 你 一样 大 长 腿 青春 无敌 美少女 少女 任 帅 秒 拍 视频	25
2226	开放二胎	骑着电动车考察了几次幼儿园......就这么定下了......听说国外很多不限购奶粉的国家听说中国开放二胎已经开始限购了......哎......真不容易啊......还好目前我快熬过三年奶粉艰难期......祝福大家好运！！！	FAVOR	骑 着 电动 电动车 动车 考察 几次 幼儿 幼儿园 就 这么 定下 听说 国外 很多 不 限购 奶粉 国家 听说 中国 开放 二胎 已经 开始 限购 哎 真不 真不容易 不容 容易 啊 还好 目前 我 快 熬过 三年 奶粉 艰难 期 祝福 大家 好运	44
2227	开放二胎	所以开放二胎，就问：我都开放了你为什么不生？什么破玩意儿，你特么说生就生啊！玩怎么多年了，谁知道你什么时候又变啊！ |90后断崖式...	AGAINST	所以 开放 二胎 就 问 我 都 开放 你 为什么 什么 不 生 什么 破 玩意 玩意儿 你 特 么 说 生就 生 啊 玩 怎么 多年 谁 知道 你 什么 时候 又 变 啊 number 后 断崖 式	39
2229	开放二胎	原配由于年龄或其他问题不生，就把指标下放给二奶。阖家欢乐，其乐融融。。。	NONE	原配 由于 年龄 或 其他 问题 不 生 就 把 指标 下放 给 二奶 阖家 阖家欢 阖家欢乐 欢乐 其乐融融 乐融融 融融	21
2230	开放二胎	#bilibili#【狗粮系列】20160423奇然二胎歌会（恭c大法好，坠丁一生推）  UP主：幺推 |【狗粮系列...	NONE	bilibili 狗 粮 系列 number 奇 然 二胎 歌会 恭 c 大法 好 坠 丁 一生 推 up 主 幺 推 狗 粮 系列	24
2231	开放二胎	什么事都没耽误，照样照顾我大宝，倒不是没人帮我，而是大宝是个小活宝，照顾她快乐更多，整个孕期一眨眼就要过去了，过程是美好的，结局希望也这样美好	FAVOR	什么 事 都 没 耽误 照样 照顾 我 大宝 倒 不是 没 人 帮 我 而是 大宝 是 个 小 活宝 照顾 她 快乐 更 多 整个 孕期 一眨 一眨眼 眨眼 就要 过去 过程 是 美好 结局 希望 也 这样 美好	41
2232	开放二胎	专家说人口少，挣钱不够花就开放二胎。中国是专家统治的社会吗？	AGAINST	专家 说 人口 少 挣钱 不够 花 就 开放 二胎 中国 是 专家 统治 社会 吗	16
2233	开放二胎	生育权是基本人权，甭说全面二胎，就是全面百胎都是对国人的羞辱，国人已经习惯在羞辱中生存。	AGAINST	生育 生育权 是 基本 人权 甭说 全面 二胎 就是 全面 百 胎 都 是 对 国人 羞辱 国人 已经 习惯 在 羞辱 中 生存	24
2234	开放二胎	不想拼！ 如果是开放娶二房你试试？个个都会血拼到底 ................  把这条说说转到你朋友圈，看有多少人评论…… ]今天这句话，真火呀 |北京·东直...	NONE	不想 拼 如果 是 开放 娶 二房 你 试试 个个 都 会 血 拼到 拼到底 到底 把 这条 说 说 转到 你 朋友 朋友圈 看 有 多少 人 评论 今天 这 句 话 真 火 呀 北京 东直	38
2235	开放二胎	哦！我好想生双胞胎	FAVOR	哦 我 好 想 生 双胞 双胞胎 胞胎	8
2236	开放二胎	光开放二胎有屁用还不是女人辛苦又生又带又赚钱请求开放二夫一个赚钱一个带娃迪拜女人只花钱 德国女人只工作日本女人只带孩子 中国女人就是尼玛超人女汉子你得工作创业洗衣服做饭带孩子孝顺长辈教育子女对外和谐社会关系对内和谐家庭关系谁说女人是水做的中国女人简直就是钢筋水泥 |兰州·定西...	AGAINST	光 开放 二胎 有 屁用 还 不是 女人 辛苦 又 生 又 带 又 赚钱 请求 开放 二 夫 一个 赚钱 一个 带 娃 迪拜 女人 只 花钱 德国 女人 只 工作 日本 女人 只 带 孩子 中国 女人 就是 尼玛 超人 女 汉子 你 得 工作 创业 洗衣 洗衣服 衣服 做饭 带 孩子 孝顺 长辈 教育 子女 对外 和谐 社会 社会关系 关系 对内 和谐 家庭 关系 谁 说 女人 是 水 做 中国 女人 简直 就是 钢筋 钢筋水泥 水泥 兰州 定西	82
2237	开放二胎	喜怒哀乐，一年时间，好在宝宝健康安然的在我怀里。感谢所有家人，感谢比妈妈坚强的宝宝，爱你们！ps：睡在妈妈儿时小床的宝宝是不是在好梦中～	FAVOR	喜怒 喜怒哀乐 哀乐 一年 时间 好 在 宝宝 健康 安然 在 我 怀里 感谢 所有 家人 感谢 比 妈妈 坚强 宝宝 爱 你们 ps 睡 在 妈妈 儿时 小床 宝宝 是不是 不是 在 好 梦 中	36
2239	开放二胎	我要生一个哥哥再生一个妹妹，想想妹控我的心就化了	FAVOR	我 要 生 一个 哥哥 再生 一个 妹妹 想想 妹 控 我 心 就 化	15
2240	开放二胎	“18个月大的大山亲肚子里的弟弟 #大宝##萌娃##混血##二胎日记#”我的秒拍作品，一起来看~|秒拍视频（使用#秒拍#录制）	FAVOR	number 个 月 大 大山 亲 肚子 里 弟弟 大宝 萌 娃 混血 二胎 日记 我 秒 拍 作品 一起 来看 秒 拍 视频 使用 秒 拍 录制	28
2241	开放二胎	简直是灾难。为什么要开放二胎，大中国都要挤炸了好么	AGAINST	简直 是 灾难 为什么 什么 要 开放 二胎 大 中国 都 要 挤 炸 好 么	16
2242	开放二胎	说是要响应国家政策，这么一说那我也在响应国家晚婚晚育的政策啊。	FAVOR	说 是 要 响应 国家 政策 这么 一 说 那 我 也 在 响应 国家 晚婚 晚婚晚育 晚育 政策 啊	20
2243	开放二胎	一个大三）我：政府都开放二胎啦！女：我已经两个啦！我：所以你可以继续生啦！有问题咩？然后，我们say bye。	FAVOR	一个 大三 我 政府 都 开放 二胎 啦 女 我 已经 两个 啦 我 所以 你 可以 继续 生 啦 有 问题 咩 然后 我们 say bye	27
2244	开放二胎	反思过没有！现在越来越多人头胎都选择到美国生，这是为什么？理由很简单啊，有条件当然得给孩子最好的。@美家尔湾赴美生子美国月子中心	FAVOR	反思 过 没有 现在 越来 越来越 多 人 头胎 都 选择 到 美国 生 这 是 为什么 什么 理由 很 简单 啊 有 条件 当然 得 给 孩子 最好 美 家 尔 湾 赴美 生子 美国 月 子 中心	39
2245	开放二胎	红鸡蛋滚滚红鸡蛋是不是可以再要个二胎	FAVOR	红 鸡蛋 滚滚 红 鸡蛋 是不是 不是 可以 再 要 个 二胎	12
2246	开放二胎	超女锅铲小妹 逗比你砸这么逗，这个称呼用在你身上简直再合适不过了，支持你@青春无敌美少女任帅 |秒拍视频	NONE	超女 锅铲 小妹 逗 比 你 砸 这么 逗 这个 称呼 用 在 你 身上 简直 再 合适 不过 支持 你 青春 无敌 美少女 少女 任 帅 秒 拍 视频	30
2247	开放二胎	盐城奶奶坐不住了，说你们只管生我来帮你们带。	NONE	盐城 奶奶 坐不住 不住 说 你们 只管 生 我 来 帮 你们 带	13
2249	开放二胎	有谁会吗？关于全面开放二胎政策的！ http://t.cn/R2w3NrM	NONE	有 谁 会 吗 关于 全面 开放 二胎 政策 http t cn r2w3nrm	13
2250	开放二胎	但是为什么我的权益不能得到却要求我们签字，威胁我家人不签字就停工作，难道现在拆迁都是打着政府的旗号然后就这么霸道吗？宝宝心里苦啊	AGAINST	但是 为什么 什么 我 权益 不能 得到 却 要求 我们 签字 威胁 我家 人 不 签字 就 停 工作 难道 现在 拆迁 都 是 打着 政府 旗号 然后 就 这么 霸道 吗 宝宝 心里 苦 啊	36
2251	开放二胎	你懂的。其他同学有点怒，问他啥意思，有人帮忙打圆场说可能他指的是生二胎用脐带血，那个牲口还对帮他圆场的女生冷嘲热讽说你是医疗公司的推销员吧。事实证明牲口就算念到研究生也依然是牲口	NONE	你 懂 其他 其他同学 同学 有点 怒 问 他 啥意思 意思 有人 帮忙 打圆场 圆场 说 可能 他 指 是 生二胎 二胎 用 脐带 脐带血 那个 牲口 还 对 帮 他 圆场 女生 冷嘲 冷嘲热讽 嘲热 讽 说 你 是 医疗 公司 推销 推销员 事实 事实证明 实证 证明 牲口 就算 念 到 研究 研究生 也 依然 是 牲口	58
2253	开放二胎	口这么多。这么多（）…为什么不计划生育还开放二胎？？	AGAINST	口 这么 多 这么 多 为什么 什么 不 计划 计划生育 生育 还 开放 二胎	14
2254	开放二胎	谁谁结婚了，谁谁生二胎了，最后一句，你不急吗？爸妈不催吗？  现代中国女性真的是全身心投入到抗衰老中又把自己往衰老的死路上逼.如果我说婚姻应该建立在爱之上，会不会被喷幼稚.	NONE	谁 谁 结婚 谁 谁 生二胎 二胎 最后 一句 你 不 急 吗 爸妈 不 催 吗 现代 中国 女性 真的 是 全身 全身心 身心 投入 到 抗衰老 衰老 中 又 把 自己 往 衰老 死 路上 逼 如果 我 说 婚姻 应该 建立 在 爱 之上 会 不会 被 喷 幼稚	52
2255	开放二胎	二胎的话题总是这么吸引眼球请看一名小学生对妈妈二胎的看法。	NONE	二胎 话题 总是 这么 吸引 眼球 请 看 一名 小学 小学生 学生 对 妈妈 二胎 看法	16
2256	开放二胎	出来没岗位工作，然后哄高房价买不起房，性别选择娶不着媳妇，人口潮红利多多哦	AGAINST	出来 没 岗位 工作 然后 哄 高房价 房价 买不起 房 性别 选择 娶 不着 媳妇 人口 潮红 利多 多 哦	20
2260	开放二胎	母亲对第一个孩子的关注和注意都会减少，而第一个孩子如果已经超过2岁或者更大，往往能够很容易地感知到与父母间的亲密关系已经被弟弟妹妹的到来而破坏。	FAVOR	母亲 对 第一 第一个 一个 孩子 关注 注意 都 会 减少 而 第一 第一个 一个 孩子 如果 已经 超过 number 岁 或者 更 大 往往 能够 很 容易 地 感知 到 与 父母 间 亲密 亲密关系 关系 已经 被 弟弟 妹妹 到来 而 破坏	44
2263	开放二胎	！你要我怎么教育孩子热爱祖国！！怕一胎养坏了所以开放二胎的吗！	AGAINST	你 要 我 怎么 教育 孩子 热爱 热爱祖国 爱祖国 祖国 怕 一胎 养 坏 所以 开放 二胎 吗	18
2264	开放二胎	就是不知道为什么不立个法！那么多家庭因为失踪孩子破碎 ！百姓的呼吁声那么多 但从来没有解决的方案出来！	AGAINST	就是 不 知道 为什么 什么 不 立 个 法 那么 多 家庭 因为 失踪 孩子 破碎 百姓 呼吁 声 那么 多 但 从来 没有 解决 方案 出来	27
2265	开放二胎	产前、产后该注意的事项，都给你准备齐了。（健康养生知识）	FAVOR	产 前 产后 该 注意 事项 都 给 你 准备 齐 健康 养生 知识	14
2266	开放二胎	骗子反应超快的说出了我的名字，问是不是才生了宝宝叫什么名字，说国家开放二胎政策，有1600的疫苗补贴，让我联系图二的号码，然而她那口港台腔深深地出卖了她。。。	NONE	骗子 反应 超 快 说出 我 名字 问 是不是 不是 才 生 宝宝 叫 什么 名字 说 国家 开放 二胎 政策 有 number 疫苗 补贴 让 我 联系 图 二 号码 然而 她 那 口 港台 港台腔 深深 深深地 出卖 她	41
2267	开放二胎	11点前睡觉。搞好身体，弄好形象，为以后生二胎提前准备，哈哈哈哈哈哈哈！ |襄阳·沃尔...	FAVOR	number 点 前 睡觉 搞好 身体 弄 好 形象 为 以后 生二胎 二胎 提前 提前准备 准备 哈哈 哈哈哈 哈哈哈哈 哈哈 哈哈哈 哈哈 哈哈 哈哈哈 哈哈 襄阳 沃 尔	28
2268	开放二胎	有种见证历史的感觉，明年还会整出什么幺蛾子且让人民拭目以待？。然而律法能规范人的行为，却禁锢不了思想，时代早已经变化得太快了。	AGAINST	有种 见证 历史 感觉 明年 还 会 整出 什么 幺 蛾子 且 让 人民 拭目 拭目以待 以待 然而 律法 能 规范 人 行为 却 禁锢 不了 思想 时代 早 已经 变化 得 太 快	34
2269	开放二胎	我读法理学、政治学与经济学，即知所谓的「人权」的全部就是「财产权」，生育权也是财产权的衍生权力，没有相应的财产，生那么多不是耍流氓吗？	NONE	我 读 法理 法理学 理学 政治 政治学 治学 与 经济 经济学 济学 即 知 所谓 人权 全部 就是 财产 财产权 产权 生育 生育权 也 是 财产 财产权 产权 衍生 权力 没有 相应 财产 生 那么 多 不是 耍流氓 流氓 吗	40
2271	开放二胎	然而仔细想想，兴许国家压根不在乎，本来想要的就只是未来的廉价劳动力而已！(⊙o⊙)细思恐极！我还是吃个橙子压压惊吧！	AGAINST	然而 仔细 想想 兴许 国家 压根 不在 不在乎 在乎 本来 想要 就 只是 未来 廉价 劳动 劳动力 动力 而已 细 思 恐 极 我 还是 吃 个 橙子 压 压惊	30
2272	开放二胎	目前来看，二胎概率比较大，因为恩溪目前没有给我带来负担和压力，反而有时候会后悔生孩子有点迟了，有了孩子后并没有之前想象的那么不堪不如意和不美好，家庭反而更完美。 |临汾·新东...	FAVOR	目前 来看 二胎 概率 比较 大 因为 恩 溪 目前 没有 给 我 带来 负担 压力 反而 有时 有时候 时候 会 后悔 生 孩子 有点 迟 有 孩子 后 并 没有 之前 想象 那么 不堪 不如 不如意 如意 不 美好 家庭 反而 更 完美 临汾 新东	46
2273	开放二胎	请等等再生好吗，这波结婚的还没弄完你们就赶着上来了，我的月钱就天天给你们做未来投资了，我是要结几次婚，生几个娃才能奔小康啊！！！！！	NONE	请 等等 再生 好 吗 这 波 结婚 还 没 弄完 你们 就 赶着 上来 我 月 钱 就 天天 给 你们 做 未来 投资 我 是 要 结 几次 婚 生 几个 娃 才能 奔小康 小康 啊	38
2276	开放二胎	而是留下一个亲人。	FAVOR	而是 留下 一个 亲人	4
2277	开放二胎	二胎的美好日常	FAVOR	二胎 美好 日常	3
2278	开放二胎	老子一点也不孤独啊，就特么这么被代表了！	FAVOR	老子 一点 也 不 孤独 啊 就 特 么 这么 被 代表	12
2282	开放二胎	一是油价大幅度走低刺激，二是网络约车加剧，十几万辆车注册，每天活跃的有6万辆，一天六七十万单在路上跑。http://t.cn/RbEiJVf	NONE	一 是 油价 大幅 大幅度 幅度 走低 刺激 二 是 网络 约 车 加剧 十几 十几万 几万 辆车 注册 每天 活跃 有 number 万辆 一天 六七 六七十 六七十万 七十 七十万 十万 单 在 路上 跑 http t cn rbeijvf	39
2285	开放二胎	疯了婆婆，苦了媳妇。。	AGAINST	疯 婆婆 苦 媳妇	4
2286	开放二胎	你自己想生就生啊！你管我！我就喜欢让我的孩子孤独寂寞冷行了吧！	AGAINST	你 自己 想 生就 生 啊 你 管 我 我 就 喜欢 让 我 孩子 孤独 孤独寂寞 寂寞 冷 行	20
2289	开放二胎	以后像开放二胎一样没人响应我就笑了！鬼来看你的电视剧，劝拍电视的转行拍电影得了，不行还要被禁！你们还是转行写小说吧，相信看的人不少！	AGAINST	以后 像 开放 二胎 一样 没 人 响应 我 就 笑 鬼 来看 你 电视 电视剧 劝 拍 电视 转行 拍电影 电影 得 不行 还要 被 禁 你们 还是 转行 写 小说 小说吧 相信 看 人 不少	37
2290	开放二胎	现在一胎还在肚子里，就开始不停的被问还要不要二胎了	NONE	现在 一胎 还 在 肚子 里 就 开始 不停 被 问 还要 不要 二胎	14
2292	开放二胎	推動了我國的發展，然後又開放二胎，增加智障人口基數，我國富強！	AGAINST	推 動 我 國 發 展 然 後 又 開 放 二胎 增加 智障 人口 基 數 我 國 富 強	21
2294	开放二胎	也是这样一个雪天奶奶走了十几里山路来医院看我 不想过生日了是因为每次回家都觉得父母又老了 过一个生日表明老妈当妈妈的岁月又长了一个年轮 还是离家近点好 这就是独生子女的悲哀 国家开放二胎政策是对的 给我买烤山芋的人和陪我烘火看电视的两位健康 开心哈	FAVOR	也 是 这样 一个 雪天 奶奶 走 十几 十几里 几里 山路 来 医院 看 我 不想 过生日 生日 是因为 因为 每次 回家 都 觉得 父母 又 老 过 一个 生日 表明 老妈 当 妈妈 岁月 又 长 一个 年轮 还是 离家 离家近 点 好 这 就是 独生 独生子 独生子女 生子 子女 悲哀 国家 开放 二胎 政策 是 对 给 我 买 烤 山芋 人 陪 我 烘 火 看电视 电视 两位 健康 开心 哈	74
2295	开放二胎	我最想干的事就是直接走掉、满世界去飘荡、但是真心不可能我不可能丢掉我家人啊啊啊啊啊啊、我真的好想自己自由的去满世界跑啊！！现在觉得二胎政策真好！减压、减责任啊！	FAVOR	我 最 想 干的事 就是 直接 走掉 满 世界 去 飘荡 但是 真心 不 可能 我 不 可能 丢掉 我家 人 啊啊啊 啊啊啊 我 真的 好 想 自己 自由 去 满 世界 跑 啊 现在 觉得 二胎 政策 真 好 减压 减 责任 啊	44
2296	开放二胎	因为猴年生女儿不好。 好礼，问题来了。 CX是几个意思呢？ |苏州·枫桥...	FAVOR	因为 猴 年 生 女儿 不好 好 礼 问题 来 cx 是 几个 意思 呢 苏州 枫桥	17
2298	开放二胎	预产期预计在11月份，引发网友热议。同日，其前夫凌潇肃出席电视剧发布会，虽然没|姚晨高调宣...	NONE	预产 预产期 产期 预计 在 number 月份 引发 网友 热 议 同日 其 前夫 凌 潇 肃 出席 电视 电视剧 发布 发布会 虽然 没 姚 晨 高调 宣	28
2300	开放二胎	成绩优异，还可奖励辆车。不料，今年两人第二次考研失败，无奈只能推迟婚期再考第三次。（法晚）http://t.cn/RqCqMtC	NONE	成绩 优异 还 可 奖励 辆车 不料 今年 两 人 第二 第二次 二次 考研 失败 无奈 只能 推迟 婚期 再 考 第三 第三次 三次 法 晚 http t cn rqcqmtc	30
2301	开放二胎	现在打感情牌，以后打法律牌，要么年龄差不多，差个十几岁的。所以现在谁差十几岁然后要生个二胎的，最好早点脱离父母关系。	AGAINST	现在 打 感情 牌 以后 打 法律 牌 要么 年龄 差不多 不多 差 个 十几 十几岁 几岁 所以 现在 谁 差 十几 十几岁 几岁 然后 要 生 个 二胎 最好 早点 脱离 父母 关系	34
2302	开放二胎	37岁姚晨11月生二胎：给小土豆添小伙伴啦	FAVOR	number 岁 姚 晨 number 月 生二胎 二胎 给 小土 小土豆 土豆 添 小伙 小伙伴 伙伴 啦	17
2303	开放二胎	不是怕胖，是打针今天抽了四管血。很没出息的眼里泛泪花了	FAVOR	不是 怕 胖 是 打针 今天 抽 四 管 血 很 没出 没出息 出息 眼里 泛 泪花	17
2304	开放二胎	第二个是二胎，第三个暂时还没有动静，不过这第三个爱秀恩爱，比如她以前曾迷过钟汉良一段时间，那段时间她老公就把社交头像换成钟汉良了	NONE	第二 第二个 二个 是 二胎 第三 第三个 三个 暂时 还 没有 动静 不过 这 第三 第三个 三个 爱 秀 恩爱 比如 她 以前 曾 迷 过 钟汉良 一段 一段时间 段时间 时间 那 段时间 时间 她 老公 就 把 社交 头像 换成 钟汉良	42
2306	开放二胎	我们出生的时候要罚款，上小学的时候大学还是免费的，上初中的时候小学开始免费，高中一毕业，九年义务教务全免，真是360度无死角地完美避开了所有福利，这专业坑90后20年的节奏真是活不起	AGAINST	我们 出生 时候 要 罚款 上 小学 时候 大学 还是 免费 上 初中 时候 小学 开始 免费 高中 一 毕业 九年 义务 教务 全免 真是 number 度 无 死角 地 完美 避开 所有 福利 这 专业 坑 number 后 number 年 节奏 真是 活 不 起	46
2307	开放二胎	特定时间内怀不上就取消。若不遵守会被换岗甚至辞退，有老师称被排到二零二几年…县教体局回复：“学校是教书育人的地方，不是叫你去生二胎的。”|河南一高中...	NONE	特定 时间 内 怀 不 上 就 取消 若 不 遵守 会 被 换岗 甚至 辞退 有 老师 称 被 排到 二 零 二 几年 县 教体局 回复 学校 是 教书 教书育人 育人 地方 不是 叫 你 去 生二胎 二胎 河南 一 高中	43
2308	开放二胎	你怕饿着了孩子，吃点东西我能理解你，但能不能拜托你不要到车厢里吃啊，你一个人舒服了，可是其他人呢😶@南昌地铁	FAVOR	你 怕 饿 着 孩子 吃 点 东西 我 能 理解 你 但 能 不能 拜托 你 不要 到 车厢 里 吃 啊 你 一个 人 舒服 可是 其他 其他人 他人 呢 南昌 地铁	34
2309	开放二胎	原来不是“开放二胎”而是“鼓励二胎” 还把晚婚晚育的政策取消了 忽然想起以前计划生育时候的口号“只生一个好”还有什么“晚婚晚育质量高”...piapia打脸 完全一副“就是让你们多生点廉价劳动力 不用太在意质量”的节奏么	AGAINST	原来 不是 开放 二胎 而是 鼓励 二胎 还 把 晚婚 晚婚晚育 晚育 政策 取消 忽然 想起 以前 计划 计划生育 生育 时候 口号 只 生 一个 好 还有 什么 晚婚 晚婚晚育 晚育 质量 高 piapia 打 脸 完全 一副 就是 让 你们 多 生点 廉价 劳动 劳动力 动力 不用 太 在意 质量 节奏 么	53
2310	开放二胎	为什么不早一点开放二胎政策 没人一起去海底世界看鱼 也没人一起去动物园看羊驼 一起和我撩猫的人都没有 也没有人可以让我捏捏脸	FAVOR	为什么 什么 不 早 一点 开放 二胎 政策 没 人 一起 去 海底 世界 看 鱼 也 没人 一起 去 动物 动物园 看 羊 驼 一起 我 撩 猫 人 都 没有 也 没有 人 可以 让 我 捏 捏 脸	41
2311	开放二胎	教师有二胎证才能上岗，外地人有二胎证才能落户，买房有二胎证才能发本，买车有二胎证才能摇号。。。。	AGAINST	教师 有 二胎 证 才能 上岗 外地 外地人 有 二胎 证 才能 落户 买房 有 二胎 证 才能 发 本 买车 有 二胎 证 才能 摇 号	27
2312	开放二胎	你们这些贱民不肯食转基因食物，又不肯去死，这样我们农大学生很难为呢	AGAINST	你们 这些 贱民 不肯 食 转基因 基因 食物 又 不肯 去 死 这样 我们 农 大学 大学生 学生 很 难为 呢	21
2313	开放二胎	原本生小孩的人就多，国家还开放二胎政策儿科忙到想哭一直到现在才有时间去吃饭，真的是要疯了	AGAINST	原本 生小孩 小孩 人 就 多 国家 还 开放 二胎 政策 儿科 忙 到 想 哭 一直 到 现在 才 有 时间 去 吃饭 真的 是 要 疯	28
2314	开放二胎	怒那也在酝酿中，真心觉得三巡看不了了，茶蛋演唱会太挤。不像老周陈奕迅的，希望明年电影可以去看。	FAVOR	怒 那 也 在 酝酿 中 真心 觉得 三 巡 看 不了 茶 蛋 演唱 演唱会 太 挤 不 像 老周 陈 奕 迅 的 希望 明年 电影 可以 去 看	31
