ID	TARGET	TEXT	STANCE	WORDS	LENGTH
823	春节放鞭炮	每年过年原来梅城新县城过年是可以有放鞭炮习俗，不知道今年梅县成了梅县区还可以继续放吗，你支持梅县区可以放鞭炮吗？http://t.cn/8ksFWQu	FAVOR	每年 过年 原来 梅 城 新 县城 过年 是 可以 有 放鞭 放鞭炮 鞭炮 习俗 不 知道 今年 梅县 成 梅县 区 还 可以 继续 放 吗 你 支持 梅县 区 可以 放鞭 放鞭炮 鞭炮 吗 http t cn number ksfwqu	41
824	春节放鞭炮	大悟春节不禁，武汉市区全禁，北京城区限放。个人觉得真不放也没什么。节日气氛是没小时候浓，但跟放鞭炮没啥关系。	FAVOR	大悟 春节 不禁 武汉 武汉市 区 全 禁 北京 城区 限 放 个人 觉得 真 不放 也 没什么 什么 节日 气氛 是 没 小时 小时候 时候 浓 但 跟 放鞭 放鞭炮 鞭炮 没 啥 关系	35
826	春节放鞭炮	分享网易图集:「宜昌多部门呼吁春节不放鞭炮」 http://t.cn/Rw2CvVT	FAVOR	分享 网易 图集 宜昌 多 部门 呼吁 春节 不 放鞭 放鞭炮 鞭炮 http t cn rw2cvvt	16
827	春节放鞭炮	爸爸妈妈春节好，合家欢乐庆团圆。2.恭喜恭喜新年到，爷爷奶奶抿嘴笑。爸爸妈妈来拜年，我在身后跟着瞧。祝福老人新年好，大家夸我懂礼貌。	FAVOR	爸爸 爸爸妈妈 爸妈 妈妈 春节 好 合家 合家欢 合家欢乐 欢乐 庆 团圆 2 恭喜 恭喜 新年 到 爷爷 爷爷奶奶 奶奶 抿嘴 抿嘴笑 爸爸 爸爸妈妈 爸妈 妈妈 来 拜年 我 在 身后 跟着 瞧 祝福 老人 新年 新年好 大家 夸 我 懂 礼貌	42
829	春节放鞭炮	身体健康，万事如意，马年行大运～！ 我在:|385省道	FAVOR	身体 身体健康 体健 健康 万事 万事如意 如意 马 年 行大运 大运 我 在 number 省道	15
830	春节放鞭炮	近期，政府出台文件，春节期间（昨天起至大年初七），禁令解除，海宁可以燃放烟花爆竹。详情见：http://t.cn/RwqRjaV	FAVOR	近期 政府 出台 文件 春节 期间 昨天 起至 大年 初七 禁令 解除 海宁 可以 燃放 燃放烟花 放烟 烟花 爆竹 详情 见 http t cn rwqrjav	25
832	春节放鞭炮	建议，对市民燃放鞭炮统一管理规范，比如指定具体燃放地点和时间，制定鞭炮销售法规等等，加大管制力度，还市民一个整洁祥和的春节环境！@青海网	AGAINST	建议 对 市民 燃放 燃放鞭炮 放鞭 放鞭炮 鞭炮 统一 管理 规范 比如 指定 具体 燃放 地点 时间 制定 鞭炮 销售 法规 等等 加大 管制 力度 还 市民 一个 整洁 祥和 春节 环境 青海 网	34
833	春节放鞭炮	又一个新年热热闹闹地向我们走来。贴春联、放鞭炮、办年货，逛庙会，每个春节民俗都有着独特的传统年味儿，在这新旧交替之际阖家团圆之时，说一说你怎么过新年的？	AGAINST	又 一个 新年 热热 热热闹闹 热闹 闹 地 向 我们 走来 贴 春联 放鞭 放鞭炮 鞭炮 办 年货 逛庙会 庙会 每个 春节 民俗 都 有着 独特 传统 年 味儿 在 这 新旧 新旧交替 旧交 交替 之际 阖家 阖家团圆 团圆 之 时 说一说 你 怎么 过 新年	46
837	春节放鞭炮	我就不放了 现在政府又不禁止了 但是我也不放 问好 ——看到吴江张建林的博文《春节不放鞭炮》有感而发的评论。http://t.cn/zYQNTHA	AGAINST	我 就 不放 现在 政府 又 不 禁止 但是 我 也 不放 问好 看到 吴江 张 建 林 博文 春节 不 放鞭 放鞭炮 鞭炮 有感 有感而发 评论 http t cn zyqntha	31
839	春节放鞭炮	近年来一些地方推出禁放、限放的措施。春节要不要放鞭炮，您怎么看？http://t.cn/R46EmuN	NONE	近年 近年来 年来 一些 地方 推出 禁放 限 放 措施 春节 要 不要 放鞭 放鞭炮 鞭炮 您 怎么 看 http t cn r46emun	23
840	春节放鞭炮	市民可以在限制燃放区域内燃放烟花爆竹。车站、码头、机场、轻轨车辆和站点、商场及其他人口密集场所禁止燃放烟花爆竹。	NONE	市民 可以 在 限制 燃放 区域 内 燃放 燃放烟花 放烟 烟花 爆竹 车站 码头 机场 轻轨 车辆 站点 商场 及其 他 人口 密集 场所 禁止 燃放 燃放烟花 放烟 烟花 爆竹	30
841	春节放鞭炮	导致大气中的有害物质尤其是PM2.5浓度激增，严重污染空气。本报联合环保部门倡议，春节少放鞭炮，减少放鞭炮天数和放鞭炮数量，一起过个环保年。	AGAINST	导致 大气 中 有害 有害物 有害物质 物质 尤其 是 pm2 5 浓度 激增 严重 污染 污染空气 空气 本报 联合 环保 环保部 环保部门 部门 倡议 春节 少 放鞭 放鞭炮 鞭炮 减少 放鞭 放鞭炮 鞭炮 天数 放鞭 放鞭炮 鞭炮 数量 一起 过 个 环保 年	43
842	春节放鞭炮	“绿色”春节的概念似乎被越来越多的人所认同。电子鞭炮和传统鞭炮，你更倾向于那种？今年春节，你放鞭炮了吗？	NONE	绿色 春节 概念 似乎 被 越来 越来越 多 人 所 认同 电子 鞭炮 传统 鞭炮 你 更 倾向 于 那种 今年 今年春节 春节 你 放鞭 放鞭炮 鞭炮 吗	28
843	春节放鞭炮	"节约用电,其实光标字“光盘”就可以了。调侃到说:干脆改名叫“陈光芒”吧，保证熠熠生辉。改名字对于标哥并不陌生，在2009年他就曾把老婆孩子的名字分别改成""张绿色""和“陈环保”。"	AGAINST	节约 节约用电 用电 其实 光标 字 光盘 就 可以 调侃 到 说 干脆 改名 叫 陈 光芒 保证 熠熠 熠熠生辉 生辉 改名 改名字 名字 对于 标 哥 并 不 陌生 在 number 年 他 就 曾 把 老婆 孩子 名字 分别 改成 张 绿色 陈 环保	46
847	春节放鞭炮	与去年同期43.04吨相比，略有减少。但不放有没有过年的气氛，试问春节放鞭炮对不对？	NONE	与 去年 去年同期 同期 43 04 吨 相比 略有 减少 但 不放 有没有 没有 过年 气氛 试问 春节 放鞭 放鞭炮 鞭炮 对 不对	23
848	春节放鞭炮	焚烧冥币的祭奠方式，尽量采取鲜花祭祀、植树祭祀等一些时尚文明的祭祀方式。*衢江云溪派出所@浙江衢州公安	AGAINST	焚烧 冥 币 祭奠 方式 尽量 采取 鲜花 祭祀 植树 祭祀 等 一些 时尚 文明 祭祀 方式 衢 江云 溪 派出 派出所 浙江 衢州 公安	25
850	春节放鞭炮	拜大年……但总有这样一群人，他们在举国欢庆时坚守岗位，在万家团聚时默默奉献！我们指挥中心的搜救协调员、交管值班员人也是他们中的一员，他们全年无休！	FAVOR	拜 大年 但 总 有 这样 一群 人 他们 在 举国 举国欢庆 国欢庆 欢庆 时 坚守 坚守岗位 岗位 在 万家 团聚 时 默默 奉献 我们 指挥 中心 搜救 协调 协调员 交管 值班 值班员 人 也 是 他们 中 一员 他们 全年 无休	42
851	春节放鞭炮	但也有人表示新年不放鞭炮就没了年味，如遭遇极端天气，则建议或者强制禁放。你支持哪边，理由？如果不燃，有何管理办法？	NONE	但 也 有人 表示 新年 不 放鞭 放鞭炮 鞭炮 就 没了 年 味 如 遭遇 极端 天气 则 建议 或者 强制 禁放 你 支持 哪边 理由 如果 不 燃 有 何 管理 办法	33
853	春节放鞭炮	要是下雪就更好了。中国最大的传统节日是春节。外国人阴历年底很少有人在自己国家放鞭炮，吃饺子。尽管中国在世界的影响力与日俱增。阿嚏，钻被窝，睡觉。	FAVOR	要是 下雪 就 更好 中国 最大 传统 传统节日 节日 是 春节 外国 外国人 国人 阴历 年底 很少 有人 在 自己 国家 放鞭 放鞭炮 鞭炮 吃饺子 饺子 尽管 中国 在 世界 影响 影响力 与日俱增 阿嚏 钻 被窝 睡觉	37
856	春节放鞭炮	拍摄了一组呼吁大家春节不放鞭炮的照片，通过此次宣传，树立全民自觉自愿“禁放”意识，真正体会到禁放人人有责，平安人人受益！祝愿所有人平平安安过春节！	AGAINST	拍摄 一组 呼吁 大家 春节 不 放鞭 放鞭炮 鞭炮 照片 通过 此次 宣传 树立 全民 自觉 自觉自愿 自愿 禁放 意识 真正 体会 到 禁放 人人 人人有责 有责 平安 人人 受益 祝愿 所有 所有人 有人 平平 平平安安 平安 安安 过 春节	40
857	春节放鞭炮	便有可能发生血的教训，所以家长们要注意孩子燃放鞭炮时的安全事项。在小编莉言语 看来：孩子放鞭炮的时候，大人一定要跟着看好孩子。	NONE	便 有 可能 发生 血 教训 所以 家长 们 要 注意 孩子 燃放 燃放鞭炮 放鞭 放鞭炮 鞭炮 时 安全 事项 在 小 编 莉 言语 看来 孩子 放鞭 放鞭炮 鞭炮 时候 大人 一定 要 跟着 看 好孩子 孩子	38
862	春节放鞭炮	春节有着各式各样的风俗，如备年货、贴春联、放鞭炮、守岁、拜年、给压岁钱等。正是这些风俗，让春节显得更加丰富多彩。	FAVOR	春节 有着 各式 各式各样 各样 风俗 如 备 年货 贴 春联 放鞭 放鞭炮 鞭炮 守岁 拜年 给 压岁 压岁钱 等 正是 这些 风俗 让 春节 显得 更加 丰富 丰富多彩 多彩	30
863	春节放鞭炮	今年春节不放鞭炮,保护我们的环境 我在这里:|回龙观	AGAINST	今年 今年春节 春节 不 放鞭 放鞭炮 鞭炮 保护 我们 环境 我 在 这里 回龙 回龙观	15
864	春节放鞭炮	会产生300公斤以上灰霾。今年春节，你还放鞭炮吗？点#春节放鞭炮#，参与话题投票吧！	AGAINST	会 产生 number 公斤 以上 灰 霾 今年 今年春节 春节 你 还 放鞭 放鞭炮 鞭炮 吗 点 春节 放鞭 放鞭炮 鞭炮 参与 话题 投票	24
865	春节放鞭炮	有人非要拿春节必须放鞭炮一说，那过去还非要一男配多女，偷情就处死，基被发现基本烧死，那你们也延续这样的传统好了。	AGAINST	有人 非要 拿 春节 必须 放鞭 放鞭炮 鞭炮 一 说 那 过去 还 非要 一 男 配 多 女 偷情 就 处死 基 被 发现 基本 烧死 那 你们 也 延续 这样 传统 好	34
867	春节放鞭炮	更是寻求合家团聚，享受亲情的时刻。祭祖、放鞭炮、团圆饭是最传统的项目，包饺子吃贡面是最期待的美食，你闻到，这股年味了吗http://t.cn/8Fqz16b	FAVOR	更是 寻求 合家 团聚 享受 亲情 时刻 祭祖 放鞭 放鞭炮 鞭炮 团圆 团圆饭 是 最 传统 项目 包 饺子 吃 贡 面 是 最 期待 美食 你 闻到 这股 年 味 吗 http t cn number fqz16b	37
868	春节放鞭炮	全国多地发生森林火灾，呼吁广大市民切勿乱丢烟头，切勿在林区及附近燃放礼花、鞭炮，切勿在坟山点烛、烧纸，切勿在田间烧稻草，切勿在林区野外用火。	AGAINST	全国 多 地 发生 森林 火灾 呼吁 广大 市民 切勿 乱 丢 烟头 切勿 在 林区 及 附近 燃放 礼花 鞭炮 切勿 在 坟山 点 烛 烧纸 切勿 在 田间 烧 稻草 切勿 在 林区 野外 用 火	38
869	春节放鞭炮	为什么还要放?难道春节的气氛就只能靠放鞭炮吗？可是话说回来，如果是我，肯定是坚决不放了，但还是阻止不了家人在大年夜放呀，唉！	AGAINST	为什么 什么 还要 放 难道 春节 气氛 就 只能 只能靠 放鞭 放鞭炮 鞭炮 吗 可是 话说回来 回来 如果 是 我 肯定 是 坚决 不放 但 还是 阻止 阻止不了 不了 家人 在 大年 大年夜 年夜 放 呀 唉	37
872	春节放鞭炮	穿新衣，但孩子可能并不知道这些习俗的由来。快过年啦，咕噜熊与您分享“年”的故事，让我们一起体验中国传统文化，品味纯正“中国味”的新年吧！http://t.cn/zYKeXEQ	FAVOR	穿 新衣 但 孩子 可能 并不知道 不知 知道 这些 习俗 由来 快 过年 啦 咕噜 熊 与 您 分享 年 故事 让 我们 一起 体验 中国 传统 文化 品味 纯正 中国 味 新年 http t cn zykexeq	37
875	春节放鞭炮	为了健康，不打算购买鞭炮；反对者：不放炮，缺少了年味！怎么样才能把年过得既有年味又环保呢？你有啥好点子？	NONE	为了 健康 不 打算 购买 鞭炮 反对 反对者 不 放炮 缺少 年 味 怎么 怎么样 才能 把 年 过 得 既有 年 味 又 环保 呢 你 有 啥 好 点子	31
876	春节放鞭炮	现在人的观念和老一代的是不同的，在他们脑子里放鞭炮是一种喜庆，一种热闹，一种节日寄托！所以对他们来说无炮可能真就不欢。 我在:|013县道	FAVOR	现在 人 观念 老一代 一代 是 不同 在 他们 脑子 脑子里 放鞭 放鞭炮 鞭炮 是 一种 喜庆 一种 热闹 一种 节日 寄托 所以 对 他们 来说 无 炮 可能 真 就 不 欢 我 在 number 县道	37
877	春节放鞭炮	这个春节你过得新颖时尚，还是“涛声依旧”？传统年味是否已经渐行渐远？你又品出了什么样的特别年味？亲，说说你感受到的年味，并@安徽日报，让我们一起来回味回味这个蛇年春节。	FAVOR	这个 春节 你 过 得 新颖 时尚 还是 涛声 依旧 传统 年 味 是否 已经 渐 行 渐 远 你 又 品出 什么 什么样 特别 年 味 亲 说 说 你 感受 到 年 味 并 安徽 日报 让 我们 一 起来 回味 回味 这个 蛇 年 春节	48
878	春节放鞭炮	承诺过年不放鞭炮的社区居民和中小学生，得到了志愿者书写的“福”字。	AGAINST	承诺 过年 不 放鞭 放鞭炮 鞭炮 社区 居民 中小 中小学 中小学生 小学 小学生 学生 得到 志愿 志愿者 愿者 书写 福 字	21
879	春节放鞭炮	#微倡议#倡议过环保春节，不放鞭炮 |微倡议 我在:|东风大街	AGAINST	微 倡议 倡议 过 环保 春节 不 放鞭 放鞭炮 鞭炮 微 倡议 我 在 东风 大街	16
880	春节放鞭炮	现如今环境就够差的了，暖冬导致的雨雪都不下，天天有雾霾，周围到处是感冒发烧的人，一冬天几乎每一人或自己的家人都感冒发烧了，可悲啊！	AGAINST	现如今 如今 环境 就 够 差 暖冬 导致 雨雪 都 不下 天天 有 雾 霾 周围 到处 是 感冒 发烧 人 一 冬天 几乎 每 一 人 或 自己 家人 都 感冒 发烧 可悲 啊	35
881	春节放鞭炮	真该消失在现代文明中，我们有很多方式可以表达节日的快乐，让日渐污浊的空气不在雪上加霜，爱地球才是人类的春节善举。	AGAINST	真 该 消失 在 现代 现代文 现代文明 文明 中 我们 有 很多 方式 可以 表达 节日 快乐 让 日渐 污浊 空气 不 在 雪上 雪上加霜 爱 地球 才 是 人类 春节 善举	32
882	春节放鞭炮	这些都少不了！除此之外，那些中国传统老规矩你还知道多少呢？小编小时候用筷子敲碗沒少挨老妈筷子打，小伙伴们快说说你的家乡还有哪些独特的传统老规矩吧！~	NONE	这些 都 少不了 不了 除此 除此之外 之外 那些 中国 传统 老规矩 规矩 你 还 知道 多少 呢 小 编 小时 小时候 时候 用 筷子 敲 碗 沒 少 挨 老妈 筷子 打 小伙 小伙伴 伙伴 们 快 说 说 你 家乡 还有 哪些 独特 传统 老规矩 规矩	47
883	春节放鞭炮	过个绿色环保春节，闷等大发财！	AGAINST	过 个 绿色 环保 春节 闷 等 大 发财	9
884	春节放鞭炮	米糠芜菁，豆腐和大葱的酱汤，米饭，牛奶。今天早晨电视里播放了中国春节放鞭炮的情景。中国人喜欢放鞭炮吧!	FAVOR	米糠 芜菁 豆腐 大葱 酱汤 米饭 牛奶 今天 早晨 电视 里 播放 中国 春节 放鞭 放鞭炮 鞭炮 情景 中国 人 喜欢 放鞭 放鞭炮 鞭炮	24
885	春节放鞭炮	其他的时间能不能规定晚上九点以后，早上6点之前不放啊？！家里有老人孩子的家伤不起啊。昨天女儿9点40躺下，快10点半了才睡。鞭炮声不断，怎么睡啊？	AGAINST	其他 时间 能 不能 规定 晚上 九点 以后 早上 number 点 之前 不放 啊 家里 有 老人 孩子 家 伤 不 起 啊 昨天 女儿 number 点 number 躺 下 快 number 点 半 才 睡 鞭炮 鞭炮声 炮声 不断 怎么 睡 啊	43
887	春节放鞭炮	除夕当晚可以延长至次日2时。为更环保、更安全、更文明，请您少放或不放鞭炮。祝您春节快乐#猴年吉祥#	AGAINST	除夕 当晚 可以 延长 至 次日 number 时 为 更 环保 更 安全 更 文明 请 您 少 放 或 不 放鞭 放鞭炮 鞭炮 祝您 春节 春节快乐 快乐 猴 年 吉祥	31
888	春节放鞭炮	瓦伦西亚的街道也有特色，种满了橘子树，整个城市弥漫了醉人的橘子花香味。最后两张是本地的海鲜市场，和为了庆祝火祭节，在大街上煮著名西班牙海鲜饭的厨师。	FAVOR	瓦伦西 瓦伦西亚 伦西亚 西亚 街道 也 有 特色 种 满 橘子 树 整个 城市 弥漫 醉人 橘子 花 香味 最后 两张 是 本地 海鲜 市场 为了 庆祝 火祭 节 在 大街 上 煮 著名 西班牙 海鲜 饭 厨师	38
890	春节放鞭炮	彻底解放烦人的过冬装备；异域风情，摩擦出律动的步伐；味蕾绽放，唇齿品鉴与大快朵颐共兼得；小伙伴们有没有想去的地方，征集意见可以直接留言。	FAVOR	彻底 解放 烦人 过冬 装备 异域 风情 摩擦 出 律动 步伐 味蕾 绽放 唇齿 品鉴 与 大快朵颐 朵颐 共 兼得 小伙 小伙伴 伙伴 们 有没有 没有 想去 地方 征集 意见 可以 直接 留言	33
891	春节放鞭炮	走亲戚等传统节目就像明星赶场，有没有什么新的过年方式？春节期间，河南值得游玩的地方有很多，也有很多新的游玩方式。详情请戳http://t.cn/8Fcuwxa @河南旅游新生活杂志	FAVOR	走亲戚 亲戚 等 传统 传统节目 节目 就 像 明星 赶场 有没有 没有 什么 新 过年 方式 春节 期间 河南 值得 游玩 地方 有 很多 也 有 很多 新 游玩 方式 详情 详情请 戳 http t cn number fcuwxa 河南 旅游 新 生活 杂志	43
892	春节放鞭炮	就是新年到了，家家户户都贴上了对联。过年可以包饺子，放鞭炮，穿新衣给亲人们百年|传统节日	FAVOR	就是 新年 到 家家 家家户户 家户 户户 都 贴 上 对联 过年 可以 包 饺子 放鞭 放鞭炮 鞭炮 穿 新衣 给 亲 人们 百年 传统 传统节日 节日	27
893	春节放鞭炮	谢谢体谅！”诚恳的语言透着辛酸。你的朋友圈被也有这张图片吗？阜阳的环卫工人和市民如何看待春节放鞭炮的？过年了，环卫工人又有啥心愿？详见明日颍州晚报。	NONE	谢谢 体谅 诚恳 语言 透 着 辛酸 你 朋友 朋友圈 被 也 有 这 张 图片 吗 阜阳 环卫 环卫工 环卫工人 工人 市民 如何 看待 春节 放鞭 放鞭炮 鞭炮 过年 环卫 环卫工 环卫工人 工人 又 有 啥 心愿 详见 明日 颍 州 晚报	43
894	春节放鞭炮	随机送出美图2014台历一本。	NONE	随机 送出 美 图 number 台历 一本	7
896	春节放鞭炮	对于春节放鞭炮的事情你怎么看 我就趴窗户看呐 ……	NONE	对于 春节 放鞭 放鞭炮 鞭炮 事情 你 怎么 看 我 就 趴 窗户 看 呐	15
897	春节放鞭炮	#警察蜀黍操碎了心#@TFBOYS-易烊千玺 春节放鞭炮消防员叔叔操碎了心捉迷藏警察叔叔操碎了心 宝宝你快向他们收代言费呀	AGAINST	警察 蜀黍 操 碎了心 tfboys 易 烊 千 玺 春节 放鞭 放鞭炮 鞭炮 消防 消防员 叔叔 操 碎了心 捉迷藏 迷藏 警察 叔叔 操 碎了心 宝宝 你 快 向 他们 收 代言 费 呀	33
898	春节放鞭炮	,,,历史问题,,咋搞,,,呵呵 ——看到陈九的博文《关于《禁止春节放鞭炮是馊主意》一文的补充发言》有感而发的评论。http://t.cn/zYSGZ6D	FAVOR	历史 问题 咋搞 呵呵 看到 陈 九 博文 关于 禁止 春节 放鞭 放鞭炮 鞭炮 是 馊主意 主意 一文 补充 发言 有感 有感而发 评论 http t cn zysgz6d	27
899	春节放鞭炮	近年来严重的空气问题让更多人决定#今年春节不放炮#。鞭炮厂商们除了减少产量之外，也推出了不少相对更环保的产品。 http://t.cn/8FIbvnX	AGAINST	近年 近年来 年来 严重 空气 问题 让 更 多 人 决定 今年 今年春节 春节 不 放炮 鞭炮 厂商 们 除了 减少 产量 之外 也 推出 不少 相对 更 环保 产品 http t cn number fibvnx	35
900	春节放鞭炮	一对小小的门神反应着我们对过年的年味越来越淡了，电影已动漫的形式，贴近生活，有趣，故事让我们回忆起小时候妈妈和我们讲的过年的事儿 为什么要放鞭炮啊 为什么家家户户贴门神啊？ 总之 有一种温暖的感觉	FAVOR	一对 小小 小小的 门神 反应 着 我们 对 过年 年 味 越来 越来越 淡 电影 已 动漫 形式 贴近 贴近生活 生活 有趣 故事 让 我们 回忆 回忆起 忆起 小时 小时候 时候 妈妈 我们 讲 过年 事儿 为什么 什么 要 放鞭 放鞭炮 鞭炮 啊 为什么 什么 家家 家家户户 家户 户户 贴 门神 啊 总之 有 一种 温暖 感觉	57
901	春节放鞭炮	火苗触及引信，一声巨响，刹时火光冲天，蘑菇云升起，类似核武爆炸。这一传统，沿袭至今，苏区百姓就是这么任性！@新浪福建@i游连城@V游福建	FAVOR	火苗 触及 引信 一声 巨响 刹时 火光 火光冲天 冲天 蘑菇 蘑菇云 升起 类似 核武 爆炸 这 一 传统 沿袭 至今 苏区 百姓 就是 这么 任性 新浪 福建 i 游 连城 v 游 福建	33
905	春节放鞭炮	看春晚，放鞭炮。	FAVOR	看 春晚 放鞭 放鞭炮 鞭炮	5
906	春节放鞭炮	因为去了部队过年。而上一个清明节，我似乎也没有回来的印象了。真是很不该。	FAVOR	因为 去 部队 过年 而 上 一个 清明 清明节 我 似乎 也 没有 回来 印象 真是 很 不该	18
907	春节放鞭炮	当每天都有人抱怨着雾霾如何如何，春节放鞭炮就真的只能是一种口号吗？如果有一天连空气都要花钱购买的时候，还有多少人在意所谓的节日气氛乐呢？	AGAINST	当 每天 都 有人 抱怨 着 雾 霾 如何 如何 春节 放鞭 放鞭炮 鞭炮 就 真的 只能 是 一种 口号 吗 如果 有 一天 连 空气 都 要 花钱 购买 时候 还有 多少 人 在意 所谓 节日 气氛 乐 呢	40
910	春节放鞭炮	这一年才一次的焰火就造成空气污染了？医病不根治乱投医，得不偿失！	FAVOR	这 一年 才 一次 焰火 就 造成 空气 空气污染 污染 医病 不 根治 乱 投医 得不偿失	16
911	春节放鞭炮	春节期间放鞭炮将加重污染指数。网友云游认为放鞭炮已经成为过年的传统习俗，不放总觉得少了点年味儿。那么听众朋友，今年春节,您打算放鞭炮吗？	NONE	春节 期间 放鞭 放鞭炮 鞭炮 将 加重 污染 指数 网友 云游 认为 放鞭 放鞭炮 鞭炮 已经 成为 过年 传统 传统习俗 习俗 不放 总 觉得 少 点 年 味儿 那么 听众 朋友 今年 今年春节 春节 您 打算 放鞭 放鞭炮 鞭炮 吗	40
912	春节放鞭炮	对空气的影响还是显而易见。我觉哒，不能一边抱怨空气质量差，一边主动去做污染空气的事。大家也表个态吧：）	AGAINST	对 空气 影响 还是 显而 显而易见 易见 我 觉 哒 不能 一边 抱怨 空气 空气质量 气质 质量 差 一边 主动 去 做 污染 污染空气 空气 事 大家 也 表 个 态	31
913	春节放鞭炮	放鞭炮。给各位亲朋好友拜年。我们也互相通了电话，很幸福。马上就要12点了，就要敲肿了、我们一块守岁、老公你的本命年、祝你越来越好、你好了我才会好@涅磐的水瓶静静	FAVOR	放鞭 放鞭炮 鞭炮 给 各位 亲朋 亲朋好友 好友 拜年 我们 也 互相 通 电话 很 幸福 马上 就要 number 点 就要 敲 肿 我们 一块 守岁 老公 你 本命 本命年 祝 你 越来 越来越 好 你好 我 才 会 好 涅 磐 水瓶 静静	44
914	春节放鞭炮	带着浓浓的传统文化气息的春节，由小年拉开了序幕。 小年要吃汤圆，在农村还要放鞭炮；小年意味着团圆， http://t.cn/zYGo6HM	FAVOR	带 着 浓浓 浓浓的 传统 文化 气息 春节 由 小 年 拉开 序幕 小 年 要 吃 汤圆 在 农村 还要 放鞭 放鞭炮 鞭炮 小 年 意味 意味着 团圆 http t cn zygo6hm	33
915	春节放鞭炮	安静、安全的春节。武汉1038家银行网点和不少酒店、餐饮店、市场也承诺不放“开门鞭”。为空气减负，也为你我健康，少放鞭炮！	AGAINST	安静 安全 春节 武汉 number 家 银行 网点 不少 酒店 餐饮 餐饮店 饮店 市场 也 承诺 不 放 开门 鞭 为 空气 减负 也 为 你 我 健康 少 放鞭 放鞭炮 鞭炮	32
916	春节放鞭炮	少出来愚民了，你们咋不提倡春节期间所有的化工厂都停工呢，汽车尾气、燃放鞭炮造成的污染能占多大的比例，舍本逐末，二逼之极！	FAVOR	少 出来 愚民 你们 咋 不 提倡 春节 期间 所有 化工 化工厂 工厂 都 停工 呢 汽车 汽车尾气 车尾 尾气 燃放 燃放鞭炮 放鞭 放鞭炮 鞭炮 造成 污染 能 占 多 大 比例 舍本逐末 二 逼 之 极	37
917	春节放鞭炮	贴福字、一家人聚在一起包饺子其乐融融，春节不放鞭炮，减少污染、减少噪音，减少花费何乐而不为呢？	AGAINST	贴 福字 一家 一家人 家人 聚在一起 一起 包 饺子 其乐融融 乐融融 融融 春节 不 放鞭 放鞭炮 鞭炮 减少 污染 减少 噪音 减少 花费 何乐而不为 不为 呢	26
